{
    "$schema": "https://json-schema.org/draft/2020-12/schema",
    "$id": "https://registry.fleetbase.io/schemas/extension.schema.json",
    "title": "Fleetbase extension manifest",
    "description": "Schema for the `extension.json` file that every Fleetbase extension bundle ships at its root. The manifest names the extension, pins its version and points at the engine (console) and/or api (server) packages the bundle contains.",
    "type": "object",
    "properties": {
        "name": {
            "type": "string",
            "description": "Human readable extension name shown in the registry and console.",
            "minLength": 1,
            "maxLength": 120
        },
        "version": {
            "type": "string",
            "description": "Release version of the bundle, as a semantic version (https://semver.org).",
            "$ref": "#/$defs/semver"
        },
        "description": {
            "type": "string",
            "description": "Short summary of what the extension does.",
            "maxLength": 2000
        },
        "engine": {
            "description": "The console (Ember engine) package in this bundle: either its npm package name or the manifest file that declares it (`package.json`).",
            "$ref": "#/$defs/packageRef"
        },
        "api": {
            "description": "The server (Laravel) package in this bundle: either its Composer package name or the manifest file that declares it (`composer.json`).",
            "$ref": "#/$defs/packageRef"
        },
        "compat": {
            "type": "object",
            "description": "Version ranges of the Fleetbase console and API this release is compatible with.",
            "properties": {
                "console": {
                    "description": "node-semver style range for `@fleetbase/console`, for example `>=0.7 <1.0`.",
                    "$ref": "#/$defs/versionRange"
                },
                "api": {
                    "description": "Composer style range for `fleetbase/core-api`, for example `^1.6`.",
                    "$ref": "#/$defs/versionRange"
                }
            },
            "additionalProperties": false
        },
        "channel": {
            "type": "string",
            "description": "Release channel the bundle is published to. Defaults to `stable` when omitted.",
            "enum": ["stable", "beta"],
            "default": "stable"
        },
        "keywords": {
            "type": "array",
            "description": "Search keywords for the registry.",
            "items": {
                "type": "string",
                "minLength": 1,
                "maxLength": 64
            },
            "maxItems": 20,
            "uniqueItems": true
        },
        "repository": {
            "type": "string",
            "description": "URL of the source repository."
        },
        "license": {
            "type": "string",
            "description": "SPDX license identifier or expression."
        },
        "author": {
            "type": "string",
            "description": "Author or publisher, for example `Fleetbase Pte Ltd <hello@fleetbase.io>`."
        }
    },
    "required": ["name", "version"],
    "anyOf": [
        {
            "required": ["engine"]
        },
        {
            "required": ["api"]
        }
    ],
    "additionalProperties": true,
    "$defs": {
        "semver": {
            "type": "string",
            "pattern": "^(0|[1-9]\\d*)\\.(0|[1-9]\\d*)\\.(0|[1-9]\\d*)(?:-((?:0|[1-9]\\d*|\\d*[a-zA-Z-][0-9a-zA-Z-]*)(?:\\.(?:0|[1-9]\\d*|\\d*[a-zA-Z-][0-9a-zA-Z-]*))*))?(?:\\+([0-9a-zA-Z-]+(?:\\.[0-9a-zA-Z-]+)*))?$"
        },
        "packageRef": {
            "type": "string",
            "minLength": 1,
            "maxLength": 214,
            "anyOf": [
                {
                    "$comment": "Manifest file name inside the bundle.",
                    "enum": ["package.json", "composer.json"]
                },
                {
                    "$comment": "npm package name, optionally scoped.",
                    "pattern": "^(@[a-z0-9-~][a-z0-9-._~]*/)?[a-z0-9-~][a-z0-9-._~]*$"
                },
                {
                    "$comment": "Composer package name (vendor/name).",
                    "pattern": "^[a-z0-9]([_.-]?[a-z0-9]+)*/[a-z0-9](([_.]|-{1,2})?[a-z0-9]+)*$"
                }
            ]
        },
        "versionRange": {
            "type": "string",
            "minLength": 1,
            "maxLength": 100,
            "$comment": "Loose check: the characters used by node-semver and Composer range syntax (operators, wildcards, hyphen ranges, `||`).",
            "pattern": "^[0-9A-Za-z.*^~<>=|! +-]+$"
        }
    }
}
