{
    "name": "Registry Bridge",
    "version": "0.1.11",
    "description": "Internal Bridge between Fleetbase API and Extensions Registry",
    "repository": "https://github.com/fleetbase/registry-bridge",
    "license": "AGPL-3.0-or-later",
    "author": "Fleetbase Pte Ltd <hello@fleetbase.io>",
    "engine": "package.json",
    "api": "composer.json"
}
